modelo,pergunta_id,pergunta,resposta,real_time_sec,gpu_percent,gpu_mem_kb
mistral_v0.3,95,what is the star sign for september 15,The star sign for September 15 depends on the exact time and location of birth. However  if we consider the tropical zodiac (most commonly used in Western astrology)  people born between approximately September 1 and September 23 are considered Virgos  while those born from around September 24 onwards are Libra. It's always best to look up your exact sun sign based on your birth date  time  and location for a more accurate astrological reading.,36.10832357406616,33,172032
mistral_v0.3,96,when do meredith and derek get back together in season 2,"In the second season of ""Grey's Anatomy "" Meredith and Derek (also known as MerDer) take a break from their relationship due to personal and professional issues. They don't officially get back together until the season finale  episode 24 (""It's the End of the World""). However  it's important to note that their reunion is brief  as Derek leaves for a fellowship in Washington D.C. at the end of the season. Their relationship continues to evolve throughout subsequent seasons.",40.91363787651062,32,173056
mistral_v0.3,97,who sings a white sport coat and a pink carnation,"The song ""A White Sport Coat (and a Pink Carnation)"" is by Marty Robbins  an American country music singer. The song was released in 1957 and became one of his most popular hits. It tells the story of a man who meets a woman at a dance wearing a white sport coat and a pink carnation.",27.371183156967163,36,174080
mistral_v0.3,98,an act of the legislature directly punishing a person or group is referred to as a​,criminal law or penal statute. These are terms used to describe laws that impose penalties  such as fines or imprisonment  on individuals or groups who violate them. It's important to note that these types of laws are typically enacted by the legislative branch of government in many legal systems.,24.589009761810303,31,175104
mistral_v0.3,99,the official u.s. poverty line is based on the cost of what,The Official U.S. Poverty Line is based on the cost of a minimal  yet adequate standard of living. This includes factors such as food  clothing  shelter  utilities  transportation  and healthcare. However  it's important to note that this line is adjusted annually to reflect changes in the cost of living.,24.62266969680786,33,174080
mistral_v0.3,100,what place did jennifer hudson get in american idol,"Jennifer Hudson did not compete on American Idol. She is a well-known singer who gained fame after appearing on another reality TV show  ""American Dreams"" (2002)  and later became known for her role as Effie White in the film adaptation of the musical ""Dreamgirls"" (2006). Jennifer Hudson did not compete on American Idol.",28.938170433044434,31,171008
