modelo,pergunta_id,pergunta,resposta,real_time_sec,gpu_percent,gpu_mem_kb
mistral_v0.3,1,the last time la dodgers won the world series,The Los Angeles Dodgers last won the World Series in 2020  defeating the Tampa Bay Rays in six games. Prior to that  they had not won since 1988 when they defeated the Oakland Athletics in five games.,36.19591212272644,32,150528
mistral_v0.3,2,who sings ain't nothing but a good time,"The song ""Ain't Nothing But a Good Time"" is sung by the band Kiss  specifically by Paul Stanley and Gene Simmons. However  it was originally recorded by the band J. Geils Band in 1979.",17.86385464668274,20,149504
mistral_v0.3,3,where does the movie the sound of music take place,"The movie ""The Sound of Music"" takes place in Austria  specifically in Salzburg during the late 1930s.",10.90774941444397,44,180224
mistral_v0.3,4,statue coming out of the ground in washington dc,"The statue you're referring to is likely the ""Freedom Statue"" or more formally known as the ""Freedom Memorial "" located at the National Mall in Washington D.C. This statue  designed by Henry Bacon and sculpted by Daniel Chester French  is part of the Lincoln Memorial Complex. It represents the emancipation of the slave and the spirit of freedom embodied in Abraham Lincoln's Gettysburg Address. However  it's important to note that there are several statues in Washington D.C.  so if this isn't the one you were thinking of  let me know  and I can help further!",44.9681453704834,24,172032
mistral_v0.3,5,field hockey is the national sport of which country,Field hockey is not the national sport of any single country. However  it is particularly popular in countries like India  Pakistan  and the Netherlands. In India  it was declared as a national game in 1928  but it does not have the status of a national sport. The national sport of India is field hockey according to tradition  but there is no official declaration.,26.446502923965454,23,163840
mistral_v0.3,6,who governs in america’s representative democracy (republic) system,In America's representative democracy (a type of republic)  the government is governed by elected officials. This includes the President  members of Congress  and other local representatives. The people have a significant role as they elect these officials to represent their interests. The Constitution serves as the fundamental governing document  outlining the powers and responsibilities of each branch of government.,25.669439554214478,21,162816
mistral_v0.3,7,who is the song you're my best friend about,"The song ""You're My Best Friend"" is by Queen  specifically sung by John Deacon. It was released on their album ""A Night at the Opera"" in 1975. Despite its light-hearted and playful tone  it became one of Queen's most popular ballads.",22.120246648788452,19,160768
mistral_v0.3,8,where was the church of latter day saints founded,The Church of Jesus Christ of Latter-day Saints  often informally referred to as the Mormon Church  was founded in New York  United States. Specifically  it was organized on April 6  1830  in Fayette  Seneca County  New York. Joseph Smith  Jr.  who claimed to have received gold plates containing sacred texts from an angel  served as the first president of the church. The church's headquarters are currently located in Salt Lake City  Utah.,35.724435567855835,18,160768
mistral_v0.3,9,who os the father of bridget jones baby,"The father of Bridget Jones in the movie ""Bridget Jones's Baby"" is revealed to be both Mark Darcy (played by Colin Firth) and Jack Qwant (played by Patrick Dempsey). However  it is later confirmed through a DNA test that Mark Darcy is the biological father. This plot twist was a surprise in the third installment of the Bridget Jones series.",28.633707523345947,20,162816
mistral_v0.3,10,who is the nationalist leader associated with the american revolution,There wasn't a single nationalist leader specifically associated with the American Revolution as such  as the Revolution was a collective effort by many individuals. However  some key figures who played significant roles in promoting the cause of American independence and could be considered nationalists include:  1. Thomas Jefferson - Drafted the Declaration of Independence  which articulated the colonies' grievances against British rule and asserted their right to self-governance. 2. George Washington - Led the Continental Army during the Revolutionary War and became the first President of the United States  helping to establish a strong central government for the new nation. 3. Benjamin Franklin - A key figure in both the political and intellectual circles of the American Revolution  he was instrumental in securing French aid for the colonies and negotiating the Treaty of Paris  which ended the war. 4. John Adams - Served as a delegate to the Continental Congress  helped draft the Declaration of Independence  and later became the second President of the United States. 5. Alexander Hamilton - A key figure in the Federalist movement  he played a significant role in shaping the new nation's financial system and foreign policy during his tenure as Secretary of,86.96190023422241,19,160768
mistral_v0.3,11,what color is the president of south koreas house,"The President of South Korea does not reside in a house  but in the Blue House (Cheong Wa Dae)  which is the official residence and workplace of the President of South Korea. However  the Blue House itself is not painted a specific color. It's named ""Blue"" because it was originally built with blue tiles on its roof. The main building is white  and the overall complex includes various buildings in different colors.",31.71541929244995,19,160768
mistral_v0.3,12,who is the security general of the un,"The United Nations does not have a Security General. The correct title is Secretary-General  and the current UN Secretary-General is António Guterres. The United Nations Department of Peacekeeping Operations (DPKO) has an Under-Secretary-General for Peacekeeping Operations who oversees the military and police personnel in peacekeeping missions. However  this position does not equate to a ""Security General.""",30.316558361053467,19,158720
mistral_v0.3,13,who won the first season of the rap game,"The first season of ""The Rap Game"" was won by Mani  also known as Miss Mulatto. She was declared the winner in 2016. The show is a reality competition series that aims to find and develop the next hip-hop superstar. It was created by Jermaine Dupri and airs on Lifetime.",26.18817639350891,18,158720
mistral_v0.3,14,actor who played tommy in terms of endearment,"The actor who played Tommy in the popular TV series ""Peaky Blinders"" is Cillian Murphy. His portrayal of Tommy Shelby has earned him much acclaim and endearment from viewers.",16.658170461654663,23,158720
mistral_v0.3,15,when did early voting start in the us,Early voting  also known as absentee voting or vote-by-mail  has been used in the United States for many years  but the specific start dates vary by state and election. The Uniformed and Overseas Citizens Absentee Voting Act (UOCAVA) of 1986 established a framework for absentee voting for military personnel and overseas citizens  and many states have since expanded early voting to all registered voters.  The exact start dates for early voting can depend on the state and the specific election. Some states offer early voting for months before an election  while others only allow it a few days or weeks before Election Day. It's best to check with your local election office or secretary of state's website for the most accurate information about early voting in your area.,59.08730340003967,18,157696
mistral_v0.3,16,list of longest running tv shows in india,"Here is a list of some of the longest-running TV shows in India  based on their duration and continuous run:  1. Doordarshan's Ramayana (1987-1988): This epic series  based on the Hindu epic Ramayana  was one of the most popular and influential television shows in Indian history. It ran for 78 episodes over a period of seven months.  2. Taarak Mehta Ka Ooltah Chashmah (2008-present): This sitcom is based on the column ""Duniya Ne Undha Chashma"" written by Taarak Mehta and has been airing since 2008. It is currently one of the longest-running shows in India.  3. CID (1998-present): This crime drama series  produced by Saraswati Entertainment Private Limited  has been running since 1998. The show follows a team of investigators as they solve various cases.  4. Mahabharat (1988-1990): Another epic series based on the Hindu epic Mahabharata  this show was",89.09136986732483,18,155648
mistral_v0.3,17,who wrote i will be home for christmas,"The song ""I'll Be Home for Christmas"" was written by Kim Gannon (lyrics) and Walter Kent (music). However  it gained popularity when it was recorded by Bing Crosby in 1943.",18.56781578063965,23,155648
mistral_v0.3,18,icc world cup outside england first time sponsor,The first ICC Cricket World Cup held outside England was the 1975 World Cup  which was co-hosted by England and Wales. However  it's important to note that the tournament didn't have a title sponsor until the 1987 World Cup  when Benson & Hedges became the first official sponsor. So  while the tournament wasn't held in England for the first time until 1975  the concept of a title sponsor didn't exist until later.,39.22962427139282,18,152576
mistral_v0.3,19,when is the draw for the european championships 2020,The Euro 2020 draw took place on November 30  2019. However  due to the postponement of the tournament to 2021 because of the COVID-19 pandemic  the actual event will take place from June 11 to July 11  2021. The draw for the revised groups was held on November 30  2020.,33.54140067100525,21,155648
mistral_v0.3,20,who plays the medical examiner on hawaii five-o,The character of the Medical Examiner on Hawaii Five-0 is Dr. Max Bergman  and he is portrayed by actor Masi Oka. Masi Oka is a Japanese-American actor  writer  and director  best known for his role as Hiro Nakamura in the television series Heroes. He joined the cast of Hawaii Five-0 in its second season.,29.08534073829651,21,155648
mistral_v0.3,21,which piece of legislation placed the protections in the european convention on human rights,The European Convention on Human Rights (ECHR) was not created by a single piece of legislation  but rather it is an international treaty drafted and signed in Rome on November 4  1950. It came into force on September 3  1953. The ECHR established the European Court of Human Rights to hear cases from individuals claiming that their rights under the Convention have been violated by a state party to the Convention. The Convention has been ratified by 47 member states of the Council of Europe  including all the EU countries plus non-EU members such as Russia and Turkey.,46.86889886856079,20,152576
mistral_v0.3,22,who sang vande maataram in 1896 congress session,"The song ""Vande Mataram"" was first sung at the 1896 Congress Session by Sister Nivedita  an Irish-born disciple of Swami Vivekananda. However  it was originally composed by Bankim Chandra Chattopadhyay in his novel ""Anandamath"" in 1870. The song gained significant popularity during the Indian independence movement and was sung by many leaders  including Lokmanya Tilak and Subhas Chandra Bose  but Sister Nivedita's rendition at the 1896 Congress Session is particularly notable.",45.87382173538208,21,155648
mistral_v0.3,23,who were the sponsor of the icc world cup when it was hosted outside england for the first time,The first ICC World Cup held outside England was in 1975  and it was sponsored by Kodak. This tournament took place in England and Wales  but subsequent editions held outside England were sponsored by different companies. For instance  the 1983 World Cup in England was sponsored by Pepsi  while the 1987 World Cup in India and Pakistan was sponsored by Coca-Cola. The 1992 World Cup in Australia and New Zealand was sponsored by Castlemaine XXXX  an Australian beer brand.,42.67100954055786,21,154624
mistral_v0.3,24,what is the most uneducated state in america,It's important to note that I don't have real-time data  and my responses are based on the information available at the time of training. According to data from the U.S. Census Bureau and the National Center for Education Statistics  states with lower average educational attainment include Louisiana  Mississippi  New Mexico  Nevada  and Alabama. However  it's crucial to remember that these statistics can vary greatly within each state  and they don't necessarily reflect the intelligence or potential of individuals living there. Education is influenced by a multitude of factors  including socioeconomic status  access to resources  and cultural norms. It's always best to approach such topics with sensitivity and understanding.,51.725276947021484,18,151552
mistral_v0.3,25,who makes the most tires in the world,The company that produces the most tires in the world is currently Bridgestone Corporation  a Japanese multinational auto and truck parts manufacturer. However  other major tire manufacturers include Michelin (French)  Goodyear Tire & Rubber Company (American)  and Continental AG (German). These companies collectively dominate the global tire market.,25.894084930419922,18,151552
mistral_v0.3,26,who argued with congress during the early years of reconstruction,During the early years of Reconstruction  there were many individuals who argued with Congress about various aspects of the post-Civil War period. One notable figure was Andrew Johnson  who served as President after the assassination of Abraham Lincoln. Johnson disagreed with many of the policies proposed by Radical Republicans in Congress  particularly those related to civil rights for freed slaves and the readmission of Southern states to the Union.  Another individual who frequently argued with Congress during this time was Ulysses S. Grant  who served as General-in-Chief of the United States Army from 1864 to 1869. Grant advocated for a more lenient approach towards the South and opposed some of the harsher measures proposed by Radical Republicans in Congress.  Other figures who argued with Congress during Reconstruction include Frederick Douglass  a prominent abolitionist and advocate for civil rights for African Americans  and Thaddeus Stevens  a Radical Republican congressman from Pennsylvania who was a leading proponent of the Freedmen's Bureau and other measures to protect the rights of freed slaves.,80.8336193561554,20,154624
mistral_v0.3,27,in humans what determines the gender of the offspring,In humans  the gender of the offspring is determined by the sex chromosomes. Normally  human cells have 23 pairs of chromosomes  for a total of 46 chromosomes. One pair of these chromosomes are the sex chromosomes  and they can be either X or Y. Females have two X chromosomes (XX)  while males have one X and one Y chromosome (XY). During fertilization  if an X-bearing sperm fertilizes an egg  the resulting offspring will be a female (XX). If a Y-bearing sperm fertilizes an egg  the resulting offspring will be a male (XY).,51.660125970840454,19,151552
mistral_v0.3,28,when did rolex daytona stop using zenith movement,The Rolex Daytona stopped using Zenith movements in the late 1980s. From 1963 to 1988  Rolex used the Valjoux 72 or 72B (manufactured by Zenith) for their Daytona models. In 1988  Rolex introduced an in-house automatic chronograph movement  the caliber 4030  which replaced the Zenith-based movements.,36.36930298805237,18,151552
mistral_v0.3,29,what is the song shine bright like a diamond about,"""Shine Bright Like a Diamond"" is a song by American singer-songwriter CeeLo Green  released in 2011. The song is an empowerment anthem that encourages individuals to embrace their uniqueness and shine brightly  despite any obstacles or adversity they may face. The lyrics often reference the idea of being a diamond in the rough  suggesting that even though one might not appear perfect on the outside  there is great beauty and value within. The song has been interpreted as a call for self-acceptance and resilience.",42.128934383392334,49,182272
mistral_v0.3,30,what does the valley mean in los angeles,"The term ""valley"" in Los Angeles often refers to the San Fernando Valley  a large urbanized region in the northern part of Los Angeles County. It's known for its suburban feel and is home to many residential neighborhoods  shopping centers  and entertainment venues. Other valleys in the greater Los Angeles area include the Santa Clarita Valley  San Gabriel Valley  and Conejo Valley. However  without a specific context  it's hard to determine exactly which valley you might be referring to.",37.495046854019165,7,175104
mistral_v0.3,31,what time period is a league of their own,"""A League of Their Own"" is a reference to a movie  not a specific time period. The movie is set during World War II  more specifically in 1943 when the All-American Girls Professional Baseball League (AAGPBL) was founded as a replacement for Major League Baseball (MLB) players who were serving in the military. The movie follows the Rockford Peaches  a fictional team in the AAGPBL.",33.809447050094604,17,178176
mistral_v0.3,32,when was harry potter and the deathly hallows part 2 movie released,"""Harry Potter and the Deathly Hallows - Part 2"" was released on July 15  2011.",12.468011379241943,23,167936
mistral_v0.3,33,the man in the high castle who is he,"The Man in the High Castle refers to a character from the novel and television series of the same name by Philip K. Dick. In the alternate history of the story  ""the man"" is a mysterious figure who smuggles forbidden films into the U.S.  showing an alternate reality where the Axis powers won World War II. The identity of ""the man"" remains unknown throughout the series  with different characters speculating about his true nature and motives.",33.91965055465698,7,164864
mistral_v0.3,34,what was the last episode of inspector morse,"The last episode of Inspector Morse  a British television series that aired from 1987 to 2000  is ""The Remorseful Day."" This episode served as both the final installment of the main series and also as a backdoor pilot for its spin-off series  Lewis. The episode was first broadcast on ITV on January 16  2000. Inspector Morse's character  played by John Thaw  does not survive the events of ""The Remorseful Day.""",40.021740198135376,7,164864
mistral_v0.3,35,who sings this crazy little thing called love,"The song ""A Crazy Little Thing Called Love"" is by Queen  and it was sung by Freddie Mercury. This iconic rock ballad was released in 1979 as part of the album ""The Game."" It's one of Queen's most popular songs due to its catchy melody and Mercury's powerful vocals.",27.546940803527832,5,164864
mistral_v0.3,36,which console to get red dead redemption 2,Red Dead Redemption 2 is available on both PlayStation 4 and Xbox One. If you already have one of these consoles  I would recommend sticking with that for compatibility reasons. However  if you don't have either  it might be worth considering the features offered by each console to decide which one better suits your needs. For example  the PlayStation 4 has exclusive games and services like PlayStation Plus  while the Xbox One offers features such as Game Pass  which provides access to a large library of games for a monthly fee. Ultimately  the choice depends on your personal preferences and gaming habits.,44.77504849433899,28,167936
mistral_v0.3,37,who won her first tennis grand slam in 2018,Naomi Osaka won her first tennis Grand Slam at the 2018 US Open. She defeated Serena Williams in the final  becoming the first Japanese player to win a Grand Slam singles title.,16.753183841705322,6,164864
mistral_v0.3,38,who sings i got you under my skin,"The song ""I've Got You Under My Skin"" was originally sung by Frank Sinatra. However  it has been covered by many other artists as well  such as Ella Fitzgerald and Dean Martin. The song was written by Cole Porter in 1936 for the musical ""Cole Porter's Jubilee.""",26.475712060928345,30,167936
mistral_v0.3,39,where did france colonize in the new world,France colonized several regions in the Americas during the Age of Exploration  primarily focusing on North America and the Caribbean. Some of the most notable French colonies include:  1. Quebec (Canada): Founded by Samuel de Champlain in 1608  Quebec City is one of the oldest European settlements in North America. The region was later expanded to form New France  which included present-day Ontario  Manitoba  and parts of the United States like Louisiana and the Mississippi Valley.  2. Acadia (Nova Scotia): Established by Pierre Dugua de Mons in 1604  Acadia was initially claimed by both the French and British but was eventually ceded to Britain in the Treaty of Utrecht in 1713. The descendants of these early settlers are known as Acadians or Cajuns (in Louisiana).  3. New Orleans (Louisiana): Founded by French explorer Pierre Le Moyne d'Iberville in 1699  New Orleans became a significant center for trade and culture in North America. The region was ceded to Spain in 1762,88.95134377479553,5,165888
mistral_v0.3,40,a management information system is which type of system,A management information system (MIS) is a type of decision-support system that provides information to help managers  or those in management roles  make informed decisions. It's designed to collect  process  store  and deliver data that is relevant to the organization's operations and goals. This can include financial reports  sales figures  production data  and more. MIS is an essential tool for effective management and decision-making in modern businesses.,32.68290591239929,22,167936
mistral_v0.3,41,when did the harry potter movie come out,"The first Harry Potter movie  ""Harry Potter and the Philosopher's Stone "" was released on November 16  2001. However  it was titled ""Harry Potter and the Sorcerer's Stone"" in North America due to a difference in naming conventions for magic-related terms between the UK and the US. The series continued with eight more movies  concluding with ""Harry Potter and the Deathly Hallows – Part 2"" on July 15  2011.",41.48086643218994,7,161792
mistral_v0.3,42,who went home on the first week of dancing with the stars juniors,"The information about the contestants and their elimination on ""Dancing with the Stars Juniors"" can vary depending on the season. I don't have real-time data  so I can't provide specific details about the first week of a particular season. However  I recommend checking out reliable sources like the official Dancing with the Stars website or TV guides for accurate information about the show's contestants and their elimination order.",32.43479514122009,30,163840
mistral_v0.3,43,where was the eastern front located in ww1,The Eastern Front during World War 1 was primarily located between the Russian Empire and the Central Powers (mainly Germany  Austria-Hungary  and Ottoman Empire). It extended from the Baltic Sea in the north to the Black Sea and the Caucasus Mountains in the south. This front saw some of the bloodiest battles of World War 1  including the Battle of Tannenberg  the Brusilov Offensive  and the Battle of Gallipoli.,36.04863262176514,27,163840
mistral_v0.3,44,who sings now that we have love what are we going to do with it,"The lyrics you've provided seem to be from a song  but they don't correspond to any specific known song in my database. However  the phrase ""Now that we have love  what are we going to do with it"" is reminiscent of several popular songs  such as ""If You Don't Know Me By Now"" by Harold Melvin & The Blue Notes or ""What Are We Going to Do With Our Love"" by Diana Ross. Without more context  it's hard to determine the exact song you're referring to. If you provide more information about the tune  artist  or era  I might be able to help identify it more accurately!",49.30210280418396,16,163840
mistral_v0.3,45,who played apollo creed in the original rocky,Apollo Creed was played by Carl Weathers in the original Rocky movie. He reprised his role in three more Rocky films  and also appeared as Apollo Creed in a cameo in Rocky Balboa (2006). Michael B. Jordan portrayed a younger version of Apollo Creed in Creed (2015)  which is a spin-off of the Rocky series.,33.156392335891724,5,158720
mistral_v0.3,46,kuchipudi is a dance form of which state,Andhra Pradesh,3.3497722148895264,7,158720
mistral_v0.3,47,what is the meaning of zhongguo renmin yinhang,"The phrase ""Zhongguo Renmin Yinhang"" is Chinese for ""China People's Bank."" It is one of the central banks in China  responsible for managing the country's foreign exchange reserves and providing financial services to the government.",20.099351167678833,6,157696
mistral_v0.3,48,where was the lion king musical first performed,The Lion King musical had its world premiere on July 8  1997  at the Orpheum Theatre in Minneapolis  Minnesota  as part of the Tony Award-winning musical's out-of-town tryout. However  it is most famously associated with its Broadway debut on October 15  1997  at the New Amsterdam Theatre in New York City. The show was later transferred to the Minskoff Theatre in 2006  where it has been running ever since.,40.18646550178528,24,160768
