modelo,pergunta_id,pergunta,resposta,real_time_sec,gpu_percent,gpu_mem_kb
mistral_v0.3,49,the federal housing administration (fha) insures lenders against,losses that occur when home loan borrowers default on their mortgages. The Federal Housing Administration (FHA) provides mortgage insurance on loans made by FHA-approved lenders  which allows these lenders to offer more favorable terms to borrowers who might not qualify for conventional loans due to limited credit histories or low down payments. This helps increase homeownership opportunities for individuals and families with lower incomes.,31.544090270996094,28,160768
mistral_v0.3,50,when the united states entered world war 1 it joined what powers,The United States initially remained neutral during World War I  but it eventually joined the Allied Powers (primarily France  Britain  and Russia) on April 6  1917. However  Russia left the war in March 1918 due to the Russian Revolution  and Germany signed an armistice with the Allies in November 1918  effectively ending World War I.,30.838310956954956,7,158720
mistral_v0.3,51,who is the main character in the labyrinth,"The main character in ""The Labyrinth"" is Sarah  played by Jennifer Connelly. She embarks on a journey through the titular labyrinth to save her baby brother Toby from the Goblin King  Jareth  who was played by David Bowie.",21.625434160232544,6,158720
mistral_v0.3,52,the predictable order of changes in communities after a change occurs,The predictable order of changes in communities after a change occurs can vary greatly depending on the nature of the community and the specific change. However  here's a general sequence that might be observed:  1. **Shock or Disruption**: Initial reaction to the change can cause shock  confusion  or resistance among community members. This phase is characterized by uncertainty and fear of the unknown.  2. **Resistance**: Some members may resist the change due to various reasons such as loss of comfort zone  fear of the unknown  or disagreement with the change.  3. **Exploration**: As time passes  some community members start to explore the changes and its potential benefits. This phase is characterized by questions  discussions  and information-seeking behavior.  4. **Experimentation**: Members begin to experiment with the new ways introduced by the change. They try out new methods  strategies  or ideas to adapt to the change.  5. **Acceptance**: Over time  as more members start to see the benefits of the change  resistance decreases and acceptance increases. This phase is characterized by a shift in attitudes from negative to positive towards the change.  6. **Integration**: The change becomes an,89.08299779891968,6,158720
mistral_v0.3,53,who came up with the name rock and roll,"The term ""rock and roll"" as a description for a specific style of music originated in the United States in the early 1950s. It's difficult to pinpoint one individual as the inventor  but it was popularized by musicians like Chuck Berry  Little Richard  and Fats Domino. The phrase itself is believed to have been used in various ways before its musical connotation  including a dance move  a slang term for sexual activity  and a style of jazz music. However  the combination of these elements into the genre we know today as rock and roll can be traced back to African-American musicians in the post-World War II era.",49.758387088775635,5,158720
mistral_v0.3,54,what is the front of your lower leg called,The front part of your lower leg is commonly referred to as the shin. More specifically  the bone you can feel there is called the tibia. The skin and muscles covering it are collectively known as the anterior compartment of the leg.,19.004117488861084,30,160768
mistral_v0.3,55,which branch of the us government makes federal laws,The legislative branch of the U.S. Government makes federal laws. This branch is composed of two chambers: the House of Representatives and the Senate. Laws are made when both the House and the Senate pass the same bill  which is then sent to the President for signature. If the President signs it  it becomes a law. If the President vetoes it  the Congress can override the veto with a two-thirds vote in both chambers.,34.71141839027405,17,160768
mistral_v0.3,56,by the year 2000 the largest number of legal immigrations to the united states came from,The largest number of legal immigrants to the United States by the year 2000 primarily came from Mexico  followed by the Philippines  India  China  and Vietnam. However  it's important to note that immigration patterns can change significantly over time due to various factors such as economic conditions  political instability  and changes in U.S. immigration policies. For the most accurate and up-to-date information  I would recommend checking with reliable sources like the U.S. Department of Homeland Security or the Migration Policy Institute.,40.48022723197937,7,158720
mistral_v0.3,57,one who signals train to start or stop,The one who signals a train to start or stop is typically a signalman  signal operator  or train dispatcher. They are responsible for controlling the movement of trains by operating track switches and activating signals to ensure safe and efficient rail traffic.,18.404810667037964,22,160768
mistral_v0.3,58,when do cory and topanga get back together after lauren,"In the Disney Channel series ""Boy Meets World "" Cory and Topanga's relationship faces a brief separation after they graduate from college  as Topanga moves to New York City for law school while Cory stays in Philadelphia. However  they eventually reunite and get married in the spin-off series ""Girl Meets World."" So  in the context of the show's timeline  their reunion happens after Lauren but before the events of ""Girl Meets World."" In real life  the actors Ben Savage (Cory) and Danielle Fishel (Topanga) did not start dating until after the series ended.",47.74342942237854,6,158720
mistral_v0.3,59,who sang out of my head over you,"The song ""Out of My Head (Over You)"" is by the American singer Alicia Keys  featuring rapper and singer John Legend. It was released in 2016 as part of her sixth studio album  ""Here.""",18.29672074317932,7,158720
mistral_v0.3,60,who is the tallest woman in the world and how tall is she,The tallest woman ever recorded was Rumeysa Ari from Turkey. She reached a height of 2 meters and 32 centimeters (approximately 7 feet 7 inches) at the age of 18. However  it's important to note that her height has fluctuated due to health issues. As of my last update  she is no longer the tallest woman in the world. Always remember that these records can change over time as new individuals may grow taller.,37.07227325439453,21,160768
mistral_v0.3,61,when was the last time the detroit tigers went to the world series,The Detroit Tigers last appeared in the World Series in 2012. They lost to the San Francisco Giants in four games. Prior to that  their most recent World Series win was in 1984 against the San Diego Padres.,20.068045139312744,32,160768
mistral_v0.3,62,who is covered by the right to financial privacy act,The Right to Financial Privacy Act (RFPA) primarily applies to individuals  not businesses or organizations. Specifically  it protects U.S. citizens and permanent resident aliens from certain types of warrantless searches and disclosures of their private financial records by government agencies. However  it's important to note that the RFPA has been largely superseded by more recent laws such as the USA PATRIOT Act  which expanded the government's ability to access financial records in certain circumstances. Always consult with a legal professional for specific advice regarding privacy rights and laws.,42.07099533081055,7,158720
mistral_v0.3,63,who is considered to be the inventor of the prepared piano,"John Cage is often credited as the inventor of the prepared piano. He began experimenting with preparing pianos in the late 1940s  by placing various objects such as screws  bolts  and erasers between the strings to alter their sound when struck. This technique allowed him to create unique timbres and textures that were not possible through traditional playing techniques. One of his most famous works using a prepared piano is ""Sonatas and Interludes"" (1946-1948).",40.03932976722717,16,160768
mistral_v0.3,64,who decided what rights should be included in the convention on the rights of the child,The Convention on the Rights of the Child was a collaborative effort among various nations  international organizations  and human rights advocates. The United Nations played a significant role in its creation. The main drafting process took place from 1979 to 1989 under the leadership of the UN's Commission on Human Rights. The Convention was eventually adopted by the United Nations General Assembly on November 20  1989  and it came into force on September 2  1990. It is important to note that the rights included in the convention were based on existing human rights principles and standards  as well as new ones specifically tailored for children.,50.270487546920776,6,158720
mistral_v0.3,65,when did the saskatchewan roughriders last won the grey cup,The Saskatchewan Roughriders last won the Grey Cup in 2013. They defeated the Hamilton Tiger-Cats with a score of 45-23 in the 101st Grey Cup game  which was held in Vancouver  British Columbia.,22.821819305419922,7,158720
mistral_v0.3,66,who played the mom in the home alone movies,"The character of Kate McCallister  the mother in the Home Alone movie series  was portrayed by Catherine O'Hara. She appeared in the first two films  ""Home Alone"" (1990) and ""Home Alone 2: Lost in New York"" (1992).",24.002490997314453,7,158720
mistral_v0.3,67,what do you call a vest in the uk,"In the UK  a vest is often referred to as a ""waistcoat."" However  it can also be called a ""vest top"" or simply a ""vest "" especially when referring to a sleeveless garment worn as an undergarment. But for clarity  ""waistcoat"" is the most common term used in formal and traditional contexts.",27.461077213287354,23,160768
mistral_v0.3,68,what age do you go to school in japan,In Japan  children typically start kindergarten (yochien) at around 6 years old. They then move on to six years of primary education (shogakko and chugakko)  which is mandatory for all children between the ages of 6 and 15. After that  they attend high school (koukou) for three years  usually starting at age 15 or 16. Some students may also choose to attend university or junior college after high school. However  the exact age can vary depending on the specific school and the child's individual circumstances.,43.55343508720398,7,158720
mistral_v0.3,69,when did indiana jones and the last crusade come out,"""Indiana Jones and the Last Crusade"" was released on May 24  1989.",10.294270992279053,5,158720
mistral_v0.3,70,when does the good witch season 4 come out,"As of my last update  there has been no official announcement about a fourth season for the TV series ""Good Witch."" The third season ended in 2018. I recommend checking the show's official website or social media accounts for updates on potential new seasons.",20.755985975265503,31,160768
mistral_v0.3,71,when did the monarchy in england lose their power,The monarchy in England  now known as the United Kingdom  underwent significant changes in its power throughout history. However  a major shift occurred during the Glorious Revolution of 1688  often considered the end of absolute monarchy and the beginning of constitutional monarchy. King James II was deposed  and his daughter Mary (a Protestant) and her husband William of Orange (also a Protestant) were invited to take the throne. This event established the supremacy of Parliament over the monarch  marking a significant loss of power for the monarchy.  However  it's important to note that the monarchy still plays an important ceremonial role in British politics today. The current system is known as a constitutional monarchy  where the monarch acts as a figurehead and exercises little political power  but their role is defined by convention rather than law.,63.86126923561096,30,160768
mistral_v0.3,72,the states which are bounded by the bay of bengal,The states in India that are bounded by the Bay of Bengal are Andhra Pradesh  Odisha  West Bengal  and Tamil Nadu. In Bangladesh  it borders Chittagong Division  Sylhet Division  Dhaka Division  and Khulna Division. Myanmar's states of Rakhine  Ayeyarwady  Bago  Yangon  Tanintharyi  Mon  Kayin  and Shan also border the Bay of Bengal. In Thailand  it borders the southernmost provinces of Narathiwat  Pattani  Yala  and Songkhla. In Indonesia  it borders the provinces of Aceh  North Sumatra  Riau Islands  Jambi  South Sumatra  Bangka Belitung Islands  Lampung  and West Kalimantan. In Malaysia  it borders the states of Kelantan  Terengganu  Pahang  Johor  and Sabah. In the Maldives  it surrounds all the islands.,77.09104037284851,30,160768
mistral_v0.3,73,why were the houston astros move to american league,The Houston Astros moved to the American League (AL) as part of Major League Baseball's realignment in 2013. Prior to this  they had been a member of the National League (NL) West division since their inception in 1962.  The reason for the move was primarily due to MLB's implementation of interleague play in 1997  which allowed AL and NL teams to play each other during the regular season. However  because the Astros were in the NL West  they had fewer opportunities to play against AL teams compared to other NL clubs.  The realignment also aimed to balance out the number of teams in both leagues  as the AL had one fewer team than the NL at that time (14 vs 16). The Astros' move to the AL West division created a more even distribution of teams between the two leagues (15 each).  Additionally  the move allowed the Astros to play against other Texas-based teams like the Rangers and the eventual expansion team  the Mariners  on a regular basis. This was seen as beneficial for both the Astros and MLB  as it increased regional rivalries and,89.18253207206726,7,158720
mistral_v0.3,74,when did the water bottle flip challenge start,"The water bottle flip challenge  a viral internet trend  started gaining significant attention in early 2017. However  it's important to note that similar challenges involving flipping objects have been around for much longer. For instance  the ""cup stacking"" challenge was popular on Vine in 2013. The water bottle flip challenge as we know it today  with the focus on flipping a water bottle upright from a vertical position  became widely recognized in early 2017.",37.130483865737915,7,158720
mistral_v0.3,75,who plays kristen dimera on days of our lives 2018,In the year 2018  Kristen DiMera was portrayed by Stacy Haiduk on Days of Our Lives. However  it's important to note that soap operas often have recurring characters and actors  so Haiduk had played the role before and has continued to play it since then.,25.3649799823761,7,158720
mistral_v0.3,76,what is the meaning of the name vinay,"The name Vinay has multiple origins and meanings. In Sanskrit  it means ""discipline"" or ""self-control."" In Hindi  it can also be a shortened form of the name Vinod  which means ""pleasant"" or ""delightful."" In Tamil  it is a variant of the name Vijay  meaning ""victory."" It's also used as a surname in some Indian communities. However  without more context  it's hard to determine the specific origin and meaning of the name Vinay in your case.",42.522313833236694,10,180224
mistral_v0.3,77,what is the italian word musicians use to describe playing a stringed instrument with a bow,"The Italian term that musicians use to describe playing a stringed instrument with a bow is ""suonare il violino"" or simply ""violino"" for the act itself. However  it's important to note that this specifically refers to the violin. If you are referring to other stringed instruments played with a bow such as the viola  cello  or double bass  their Italian names would be ""viola""  ""violoncello""  and ""contrabbasso"" respectively  with the corresponding verb being ""suonare la viola""  ""suonare il violoncello""  or ""suonare il contrabbasso"".",48.889782428741455,6,187392
mistral_v0.3,78,minimum age limit for chief justice of india,The Constitution of India does not specify a minimum age limit for the appointment of the Chief Justice of India. However  traditionally  the Chief Justice of India is appointed from among those who are above the age of 62 years. This is because the retirement age for Supreme Court judges in India is 65 years  and the Chief Justice is expected to serve until they reach that age. But it's important to note that there is no legal requirement stating that the Chief Justice must be over 62 years old at the time of appointment.,39.459296226501465,30,190464
mistral_v0.3,79,which part of a corn plant would the kernels be,The kernels in a corn plant are found within the ears or cob. The ears of corn grow protected by husks  and inside each ear  there are rows of kernels. Each kernel is a seed that can be used for consumption after being processed.,19.99773383140564,7,187392
mistral_v0.3,80,where do we find globular clusters in the galaxy,Globular clusters are found in the halo of a galaxy  including our own Milky Way. They are ancient collections of stars that orbit the galactic center. These clusters are spherical in shape and contain tens of thousands to over a million stars. Some of the most famous globular clusters in the Milky Way can be observed with the naked eye under dark skies  such as Omega Centauri and 47 Tucanae. However  many more can be seen using telescopes.,37.3637158870697,6,188416
mistral_v0.3,81,who is going to the orange bowl this year,I don't have real-time information  so I can't tell you who is going to the Orange Bowl this year. The Orange Bowl is a college football bowl game  and the teams participating change each year based on the results of the college football season. To find out who is playing in this year's Orange Bowl  you should check the latest news or official sources such as the Orange Bowl website or ESPN.,31.154133319854736,28,190464
mistral_v0.3,82,what are the nfl channels on sirius xm radio,"SiriusXM offers several channels dedicated to NFL coverage. Here are some of them:  1. NFL Radio (Channel 88): This channel provides live games  analysis  and news throughout the season.  2. Mad Dog Sports Radio (Channel 82): Hosted by Chris ""Mad Dog"" Russo  this channel offers in-depth NFL coverage and discussion.  3. NFL Network Radio (Channel 87): This channel provides 24/7 coverage of the NFL with news  analysis  and shows like ""NFL Total Access.""  4. SiriusXM Fantasy Sports Radio (Channels 210 & 157): These channels offer fantasy football advice and analysis throughout the season.  5. ESPN Radio (Channel 80): While not exclusively NFL  this channel offers live games  news  and analysis from ESPN's NFL experts.  6. SiriusXM College Football (Channels 84 & 201): During the off-season  these channels sometimes feature NFL draft coverage and other NFL-related content.",81.90908575057983,5,187392
mistral_v0.3,83,what can you do with custom firmware 3ds,Custom firmware (CFW) for the Nintendo 3DS allows users to bypass the official system restrictions and gain more control over their device. Here are some things you can do with custom firmware 3DS:  1. Run homebrew applications: Homebrew apps are unofficial software created by third-party developers that aren't available through the Nintendo eShop. These apps can range from games  emulators  utilities  and more.  2. Play backup games: With custom firmware  you can play games that have been copied onto a microSD card  as long as they are region-free or match your console's region.  3. Install themes: Customize the look of your 3DS system with various themes created by the homebrew community.  4. Use cheats and save editors: Some games support cheat codes that can be applied using tools like Cheat Searcher or Save Editor.  5. Improve battery life: Certain CFW versions offer battery life improvements through tweaks to system settings and optimizations.  6. Access region-exclusive content: Custom firmware allows you to play games from other regions  giving you access to content that may,89.00158762931824,22,190464
mistral_v0.3,84,when was the last time india won a gold medal in hockey at olympics,The last time India won an Olympic gold medal in hockey was at the 1980 Moscow Olympics. However  it's important to note that India did not participate in the 1984 Los Angeles Olympics and the 1988 Seoul Olympics due to political reasons  so their most recent gold medal win was before those games.,26.516216278076172,19,190464
mistral_v0.3,85,who owns the rights to baby shark song,"The rights to the ""Baby Shark"" song are owned by Pinkfong  a South Korean education company. They created and popularized the song through an animated video that went viral on YouTube in 2016. However  the original melody is based on a traditional Korean folk song called ""Arirang.""",24.793854475021362,7,188416
mistral_v0.3,86,how many episodes are in one punch man season 1,One Punch Man Season 1 consists of 12 episodes. Each episode is approximately 24 minutes long  totaling about 6 hours for the entire season. The series was first released in Japan in October 2015 and later aired on Adult Swim's Toonami block in the United States starting in June 2016. The show gained immense popularity due to its unique humor  action-packed sequences  and intriguing characters.,35.20256018638611,7,187392
mistral_v0.3,87,name of the bird in the lion king,"The bird in ""The Lion King"" is named Zazu. He is a red-billed hornbill and serves as Simba's royal advisor and Rafiki's assistant.",14.924998760223389,30,190464
mistral_v0.3,88,who sampled rick james give it to me baby,"The song ""Give It To Me Baby"" by Timbaland featuring Nelly Furtado  from the album ""Shock Value "" samples Rick James' original version. However  another notable sample of this song is by Will Smith in his track ""Miami"" from the album ""Big Willie Style."" Both versions use a portion of the iconic bassline and vocals from Rick James' original song.",30.836034536361694,35,208896
mistral_v0.3,89,who was fighting in the battle of amiens,The Battle of Amiens  which took place from August 8 to September 11  1918 during World War I  was primarily fought between the Allied Powers (mainly British Empire forces  French Army  and U.S. Army) against the German Empire. The battle is significant because it marked a turning point in the war on the Western Front  with the Allies launching a successful offensive that led to a rapid advance towards the German frontier.,35.67430090904236,33,202752
mistral_v0.3,90,what are the three types of wind turbines,Wind turbines can be broadly categorized into three main types based on their design and rotor configuration:  1. Horizontal-Axis Wind Turbines (HAWT): These are the most common type of wind turbine  with blades that spin around a horizontal axis. The nacelle  which contains the generator and other components  is mounted atop a tower. Examples include the traditional three-bladed design and the two-bladed Darrieus wind turbine.  2. Vertical-Axis Wind Turbines (VAWT): These turbines have blades that rotate around a vertical axis. There are several subtypes of VAWTs  including Savonius rotors  which resemble airplane propellers  and Darrieus wind turbines  which have a helicoidal shape.  3. Hybrid Wind Turbines: These are a combination of horizontal-axis and vertical-axis designs  aiming to address some of the challenges faced by traditional wind turbines  such as reduced noise levels  improved efficiency in low winds  and easier installation on complex terrain. Examples include the Jubail II turbine and the Mwind turbine.  Each type of wind turb,89.91348028182983,38,201728
mistral_v0.3,91,who plays ollie in coop and cami ask the world,"The character Ollie in the show ""Coi and Coi Ask the World"" is portrayed by actor and singer Dominic Mariche. He plays the role of Coi's older brother  Oliver ""Ollie"" Rodriguez.",19.784855127334595,31,172032
mistral_v0.3,92,who played the most seasons in nfl history,The player with the most seasons played in NFL history is Merlin Olsen  who played for 15 seasons. However  if we're talking about players who are still active  Tom Brady currently holds the record for the longest career among active players  having started his career in 2000 and continuing to play as of 2022.,27.37464475631714,33,175104
mistral_v0.3,93,who won the fifa fair play award 2018,The FIFA Fair Play Award 2018 was given to the Croatian national football team. They were recognized for their sportsmanship during the 2018 World Cup  particularly in their match against England where they showed respect and empathy towards England's goalkeeper Jordan Pickford after an injury.,23.99421453475952,30,173056
mistral_v0.3,94,where does red dead redemption 1 take place,Red Dead Redemption 1 takes place in the late 1800s  primarily in the American Old West. The game's open world is set across various regions  including the fictional towns of Blackwater and Armadillo  as well as the larger territories of New Austin  Nuevo Paraíso  and West Elizabeth. These areas are based on real-life locations such as Texas  Mexico  and the American Midwest during the decline of the American frontier.,36.821693420410156,36,175104
